sku,store_view_code,attribute_set_code,product_type,categories,name,description,short_description,weight,product_online,tax_class_name,visibility,price,special_price,special_price_from_date,special_price_to_date,url_key,meta_title,meta_keywords,meta_description,base_image,base_image_label,small_image,small_image_label,thumbnail_image,thumbnail_image_label,created_at,updated_at,new_from_date,new_to_date,map_price,msrp_price,map_enabled,qty,out_of_stock_qty,website_id,product_websites,manage_stock,use_config_manage_stock
706030,,Default,simple,Default Category/Displays/Place Holder,Acry Pegbrd Signhldr 5.5Wx3.5H,Acry Pegbrd Signhldr 5.5Wx3.5H,,0,1,Taxable Goods,"Catalog, Search",5.97,,,,acry-pegbrd-signhldr-5.5wx3.5h-706030,,,,/706030_base.jpg,Acry Pegbrd Signhldr 5.5Wx3.5H base image,/706030_base.jpg,Acry Pegbrd Signhldr 5.5Wx3.5H small image,/706030_base.jpg,Acry Pegbrd Signhldr 5.5Wx3.5H thumbnail,,,,,,,,1,0,1,base,0,0
706032,,Default,simple,Default Category/Displays/Place Holder,Acry Pegbrd Signholder 7Wx5.5H,Acry Pegbrd Signholder 7Wx5.5H,,0,1,Taxable Goods,"Catalog, Search",7.52,,,,acry-pegbrd-signholder-7wx5.5h-706032,,,,/706032_base.jpg,Acry Pegbrd Signholder 7Wx5.5H base image,/706032_base.jpg,Acry Pegbrd Signholder 7Wx5.5H small image,/706032_base.jpg,Acry Pegbrd Signholder 7Wx5.5H thumbnail,,,,,,,,1,0,1,base,0,0
706039,,Default,simple,Default Category/Displays/Place Holder,Acry Pegbrd Signholdr 8.5Wx11H,Acry Pegbrd Signholdr 8.5Wx11H,,0,1,Taxable Goods,"Catalog, Search",11.67,,,,acry-pegbrd-signholdr-8.5wx11h-706039,,,,/706039_base.jpg,Acry Pegbrd Signholdr 8.5Wx11H base image,/706039_base.jpg,Acry Pegbrd Signholdr 8.5Wx11H small image,/706039_base.jpg,Acry Pegbrd Signholdr 8.5Wx11H thumbnail,,,,,,,,1,0,1,base,0,0
706043,,Default,simple,Default Category/Displays/Place Holder,Acry Pegbrd Signholder 11Wx14H,Acry Pegbrd Signholder 11Wx14H,,0,1,Taxable Goods,"Catalog, Search",22.43,,,,acry-pegbrd-signholder-11wx14h-706043,,,,/706043_base.jpg,Acry Pegbrd Signholder 11Wx14H base image,/706043_base.jpg,Acry Pegbrd Signholder 11Wx14H small image,/706043_base.jpg,Acry Pegbrd Signholder 11Wx14H thumbnail,,,,,,,,1,0,1,base,0,0
706111E,,Default,simple,Default Category/Displays/Place Holder,Acry Pegbrd Mold Brchr Hld 4x9,"<div align=left><font size=2 face=Verdana>Molded Acrylic Brochure Holder for countertop use, or use with pegboard, slatwall, gridwall&nbsp;or wallmount.&nbsp;For 8 1/2"" x 11"" brochures or 4"" x 9"" brochures&nbsp;with pegboard.<br>701080E pictured top right.</font><font face=Verdana><br><br><font size=2>&nbsp;<img style=""HEIGHT: 155px; WIDTH: 99px"" hspace=8 vspace=8 src=""https://is30.eporia.com/company_8/677784.jpg?cvt=jpeg"">Model 702115E<br>&nbsp;&nbsp;&nbsp;&nbsp;&nbsp;&nbsp;&nbsp;&nbsp;&nbsp;&nbsp;&nbsp;&nbsp;&nbsp;&nbsp;&nbsp;&nbsp;&nbsp;&nbsp;&nbsp;&nbsp;&nbsp;&nbsp;&nbsp;&nbsp;&nbsp;&nbsp;at the left</font></font></div>","Acrylic Literature Holder for Counter, Slatwall, Gridwall Economy",0.506,1,Taxable Goods,"Catalog, Search",6.73,,,,acry-pegbrd-mold-brchr-hld-4x9-706111E,"Slatwall attachments, fixtures, displays and accessories","acrylic literature holders, molded brochure holders, counter top display, wall display, slatwall fixtures","Slatwall attachments, fixtures, displays and accessories",/706111E_base.jpg,Acry Pegbrd Mold Brchr Hld 4x9 base image,/706111E_base.jpg,Acry Pegbrd Mold Brchr Hld 4x9 small image,/706111E_base.jpg,Acry Pegbrd Mold Brchr Hld 4x9 thumbnail,,,,,,,,1,0,1,base,0,0
706115E,,Default,simple,Default Category/Displays/Place Holder,Acry Pegbrd Mold Brochr 8.5x11,"<div align=left><font size=2 face=Verdana>Molded Acrylic Brochure Holder for countertop use, or use with pegboard, slatwall, gridwall&nbsp;or wallmount.&nbsp;For 8 1/2"" x 11"" brochures or 4"" x 9"" brochures&nbsp;with pegboard.<br>701080E pictured top right.</font><font face=Verdana><br><br><font size=2>&nbsp;<img style=""HEIGHT: 155px; WIDTH: 99px"" hspace=8 vspace=8 src=""https://is30.eporia.com/company_8/677784.jpg?cvt=jpeg"">Model 702115E<br>&nbsp;&nbsp;&nbsp;&nbsp;&nbsp;&nbsp;&nbsp;&nbsp;&nbsp;&nbsp;&nbsp;&nbsp;&nbsp;&nbsp;&nbsp;&nbsp;&nbsp;&nbsp;&nbsp;&nbsp;&nbsp;&nbsp;&nbsp;&nbsp;&nbsp;&nbsp;at the left</font></font></div>","Acrylic Literature Holder for Counter, Slatwall, Gridwall Economy",0.7245,1,Taxable Goods,"Catalog, Search",8.45,,,,acry-pegbrd-mold-brochr-8.5x11-706115E,"Slatwall attachments, fixtures, displays and accessories","acrylic literature holders, molded brochure holders, counter top display, wall display, slatwall fixtures","Slatwall attachments, fixtures, displays and accessories",/706115E_base.jpg,Acry Pegbrd Mold Brochr 8.5x11 base image,/706115E_base.jpg,Acry Pegbrd Mold Brochr 8.5x11 small image,/706115E_base.jpg,Acry Pegbrd Mold Brochr 8.5x11 thumbnail,,,,,,,,1,0,1,base,0,0
70612ST,,Default,simple,Default Category/Displays/Place Holder,Acry SW Molded Shelf 12Lx6W,Acry SW Molded Shelf 12Lx6W,,0,1,Taxable Goods,"Catalog, Search",1.26,,,,acry-sw-molded-shelf-12lx6w-70612ST,,,,/70612ST_base.jpg,Acry SW Molded Shelf 12Lx6W base image,/70612ST_base.jpg,Acry SW Molded Shelf 12Lx6W small image,/70612ST_base.jpg,Acry SW Molded Shelf 12Lx6W thumbnail,,,,,,,,1,0,1,base,0,0
70618,,Default,simple,Default Category/Displays/Place Holder,Plastic Broch Hldr 6-1/8x7,Plastic Broch Hldr 6-1/8x7,,0,1,Taxable Goods,"Catalog, Search",7.16,,,,plastic-broch-hldr-6-18x7-70618,,,,/70618_base.jpg,Plastic Broch Hldr 6-1/8x7 base image,/70618_base.jpg,Plastic Broch Hldr 6-1/8x7 small image,/70618_base.jpg,Plastic Broch Hldr 6-1/8x7 thumbnail,,,,,,,,1,0,1,base,0,0
706421,,Default,simple,Default Category/Displays/Place Holder,Acry Pegboard Dbl Hosiery Bin,Acry Pegboard Dbl Hosiery Bin,,0,1,Taxable Goods,"Catalog, Search",25.06,,,,acry-pegboard-dbl-hosiery-bin-706421,,,,/706421_base.jpg,Acry Pegboard Dbl Hosiery Bin base image,/706421_base.jpg,Acry Pegboard Dbl Hosiery Bin small image,/706421_base.jpg,Acry Pegboard Dbl Hosiery Bin thumbnail,,,,,,,,1,0,1,base,0,0
707030,,Default,simple,Default Category/Displays/Place Holder,Acry SW Petg Signholdr 5.5x3.5,Acry SW Petg Signholdr 5.5x3.5,,0,1,Taxable Goods,"Catalog, Search",3.46,,,,acry-sw-petg-signholdr-5.5x3.5-707030,,,,/707030_base.jpg,Acry SW Petg Signholdr 5.5x3.5 base image,/707030_base.jpg,Acry SW Petg Signholdr 5.5x3.5 small image,/707030_base.jpg,Acry SW Petg Signholdr 5.5x3.5 thumbnail,,,,,,,,1,0,1,base,0,0
707039,,Default,simple,Default Category/Displays/Place Holder,Acry SW Petg Signholder 8.5x11,Acry SW Petg Signholder 8.5x11,,0,1,Taxable Goods,"Catalog, Search",8.71,,,,acry-sw-petg-signholder-8.5x11-707039,,,,/707039_base.jpg,Acry SW Petg Signholder 8.5x11 base image,/707039_base.jpg,Acry SW Petg Signholder 8.5x11 small image,/707039_base.jpg,Acry SW Petg Signholder 8.5x11 thumbnail,,,,,,,,1,0,1,base,0,0
707040,,Default,simple,Default Category/Displays/Place Holder,Acry SW Petg Signholder 11x8.5,Acry SW Petg Signholder 11x8.5,,0,1,Taxable Goods,"Catalog, Search",8.71,,,,acry-sw-petg-signholder-11x8.5-707040,,,,/707040_base.jpg,Acry SW Petg Signholder 11x8.5 base image,/707040_base.jpg,Acry SW Petg Signholder 11x8.5 small image,/707040_base.jpg,Acry SW Petg Signholder 11x8.5 thumbnail,,,,,,,,1,0,1,base,0,0
707324,,Default,simple,Default Category/Displays/Place Holder,Acry Shelf Blank 8x24,"<div><font color=#000000><font size=2 face=Verdana>Use these shelves with knife edge brackets for slatwall, gridwall or wall systems.&nbsp; You can use these in place of glass or wood shelves.</font></font><font size=2 face=Verdana>&nbsp;<br></font></div>",Acrylic Shelves Flat with no Attachemnt,1.955,1,Taxable Goods,"Catalog, Search",14.08,,,,acry-shelf-blank-8x24-707324,Acrylic Flat Shelf Blanks,"Acrylic Flat Shelf Blanks, display",Acrylic Flat Shelf Blanks,/707324_base.jpg,Acry Shelf Blank 8x24 base image,/707324_base.jpg,Acry Shelf Blank 8x24 small image,/707324_base.jpg,Acry Shelf Blank 8x24 thumbnail,,,,,,,,1,0,1,base,0,0
707424,,Default,simple,Default Category/Displays/Place Holder,Acry Shelf Blank 10x24,"<div><font color=#000000><font size=2 face=Verdana>Use these shelves with knife edge brackets for slatwall, gridwall or wall systems.&nbsp; You can use these in place of glass or wood shelves.</font></font><font size=2 face=Verdana>&nbsp;<br></font></div>",Acrylic Shelves Flat with no Attachemnt,2.3,1,Taxable Goods,"Catalog, Search",18.85,,,,acry-shelf-blank-10x24-707424,Acrylic Flat Shelf Blanks,"Acrylic Flat Shelf Blanks, display",Acrylic Flat Shelf Blanks,/707424_base.jpg,Acry Shelf Blank 10x24 base image,/707424_base.jpg,Acry Shelf Blank 10x24 small image,/707424_base.jpg,Acry Shelf Blank 10x24 thumbnail,,,,,,,,1,0,1,base,0,0
707524,,Default,simple,Default Category/Displays/Place Holder,Acry Shelf Blank 12x24,"<div><font color=#000000><font size=2 face=Verdana>Use these shelves with knife edge brackets for slatwall, gridwall or wall systems.&nbsp; You can use these in place of glass or wood shelves.</font></font><font size=2 face=Verdana>&nbsp;<br></font></div>",Acrylic Shelves Flat with no Attachemnt,3.105,1,Taxable Goods,"Catalog, Search",21.72,,,,acry-shelf-blank-12x24-707524,Acrylic Flat Shelf Blanks,"Acrylic Flat Shelf Blanks, display",Acrylic Flat Shelf Blanks,/707524_base.jpg,Acry Shelf Blank 12x24 base image,/707524_base.jpg,Acry Shelf Blank 12x24 small image,/707524_base.jpg,Acry Shelf Blank 12x24 thumbnail,,,,,,,,1,0,1,base,0,0
707548,,Default,simple,Default Category/Displays/Place Holder,Acry Shelf Blank 12x48,"<div><font color=#000000><font size=2 face=Verdana>Use these shelves with knife edge brackets for slatwall, gridwall or wall systems.&nbsp; You can use these in place of glass or wood shelves.</font></font><font size=2 face=Verdana>&nbsp;<br></font></div>",Acrylic Shelves Flat with no Attachemnt,3.68,1,Taxable Goods,"Catalog, Search",45.22,,,,acry-shelf-blank-12x48-707548,Acrylic Flat Shelf Blanks,"Acrylic Flat Shelf Blanks, display",Acrylic Flat Shelf Blanks,/707548_base.jpg,Acry Shelf Blank 12x48 base image,/707548_base.jpg,Acry Shelf Blank 12x48 small image,/707548_base.jpg,Acry Shelf Blank 12x48 thumbnail,,,,,,,,1,0,1,base,0,0
707646,,Default,simple,Default Category/Displays/Place Holder,Acry 6-TIER 4x9 Brochure,"<div align=left><font size=2><font face=Verdana><span lang=en-us><span lang=en-us>Multi use&nbsp;4""x 9"" and 8 1/2"" x 11"" acrylic holder for brochures. Comes with holes for wall mount, slatwall and gridwall hooks to attach for your particular need. Pricing for tiered units includes hardware set.&nbsp;</span></span>&nbsp;Extra hardware sets can be purchased separately.<br></font></font></div>",Acrylic Literature Holder Multi Tier,3.4,1,Taxable Goods,"Catalog, Search",83.4,,,,acry-6-tier-4x9-brochure-707646,Multi-Tier/Multi-Use Acrylic Brochure Holder,"Multi-Tier/Multi-Use Acrylic Brochure Holder, display, fixture",Multi-Tier/Multi-Use Acrylic Brochure Holder,/707646_base.jpg,Acry 6-TIER 4x9 Brochure base image,/707646_base.jpg,Acry 6-TIER 4x9 Brochure small image,/707646_base.jpg,Acry 6-TIER 4x9 Brochure thumbnail,,,,,,,,1,0,1,base,0,0
707683,,Default,simple,Default Category/Displays/Place Holder,Acry 3-TIER 8.5x11 Brochure,"<div align=left><font size=2><font face=Verdana><span lang=en-us><span lang=en-us>Multi use&nbsp;4""x 9"" and 8 1/2"" x 11"" acrylic holder for brochures. Comes with holes for wall mount, slatwall and gridwall hooks to attach for your particular need. Pricing for tiered units includes hardware set.&nbsp;</span></span>&nbsp;Extra hardware sets can be purchased separately.<br></font></font></div>",Acrylic Literature Holder Multi Tier,3.4,1,Taxable Goods,"Catalog, Search",95.34,,,,acry-3-tier-8.5x11-brochure-707683,Multi-Tier/Multi-Use Acrylic Brochure Holder,"Multi-Tier/Multi-Use Acrylic Brochure Holder, display, fixture",Multi-Tier/Multi-Use Acrylic Brochure Holder,/707683_base.jpg,Acry 3-TIER 8.5x11 Brochure base image,/707683_base.jpg,Acry 3-TIER 8.5x11 Brochure small image,/707683_base.jpg,Acry 3-TIER 8.5x11 Brochure thumbnail,,,,,,,,1,0,1,base,0,0
708029,,Default,simple,Default Category/Displays/Place Holder,Acry SW Econ Signholdr 3.5x5.5,Acry SW Econ Signholdr 3.5x5.5,,0,1,Taxable Goods,"Catalog, Search",2.36,,,,acry-sw-econ-signholdr-3.5x5.5-708029,,,,/708029_base.jpg,Acry SW Econ Signholdr 3.5x5.5 base image,/708029_base.jpg,Acry SW Econ Signholdr 3.5x5.5 small image,/708029_base.jpg,Acry SW Econ Signholdr 3.5x5.5 thumbnail,,,,,,,,1,0,1,base,0,0
708030,,Default,simple,Default Category/Displays/Place Holder,Acry SW Econ Signholdr 5.5x3.5,Acry SW Econ Signholdr 5.5x3.5,,0,1,Taxable Goods,"Catalog, Search",2.36,,,,acry-sw-econ-signholdr-5.5x3.5-708030,,,,/708030_base.jpg,Acry SW Econ Signholdr 5.5x3.5 base image,/708030_base.jpg,Acry SW Econ Signholdr 5.5x3.5 small image,/708030_base.jpg,Acry SW Econ Signholdr 5.5x3.5 thumbnail,,,,,,,,1,0,1,base,0,0
708032,,Default,simple,Default Category/Displays/Place Holder,Acry SW Econ Signholder 7x5.5,Acry SW Econ Signholder 7x5.5,,0,1,Taxable Goods,"Catalog, Search",3.56,,,,acry-sw-econ-signholder-7x5.5-708032,,,,/708032_base.jpg,Acry SW Econ Signholder 7x5.5 base image,/708032_base.jpg,Acry SW Econ Signholder 7x5.5 small image,/708032_base.jpg,Acry SW Econ Signholder 7x5.5 thumbnail,,,,,,,,1,0,1,base,0,0
708100,,Default,simple,Default Category/Displays/Place Holder,Acry Econ Slntbck Signholder,"<div align=left><span lang=en-us><font color=#000000 size=2 face=""Verdana, Helvetica"">These&nbsp;countertop sign holders are slanted back and made from 1/16"" acrylic and very economical to use. Sizes listed as&nbsp;Width by Height. Sold individually.</font></span></div>",Acrylic Sign Holders for Countertop Economy Slant Back,0.115,1,Taxable Goods,"Catalog, Search",2.36,,,,acry-econ-slntbck-signholder-708100,Economy Slant Back Countertop Signholders,"Economy Slant Back Countertop Signholders, display",Economy Slant Back Countertop Signholders,/708100_base.jpg,Acry Econ Slntbck Signholder base image,/708100_base.jpg,Acry Econ Slntbck Signholder small image,/708100_base.jpg,Acry Econ Slntbck Signholder thumbnail,,,,,,,,1,0,1,base,0,0
708101,,Default,simple,Default Category/Displays/Place Holder,Acry Econ Slntbck Signhld 3.5x,"<div align=left><span lang=en-us><font color=#000000 size=2 face=""Verdana, Helvetica"">These&nbsp;countertop sign holders are slanted back and made from 1/16"" acrylic and very economical to use. Sizes listed as&nbsp;Width by Height. Sold individually.</font></span></div>",Acrylic Sign Holders for Countertop Economy Slant Back,1.035,1,Taxable Goods,"Catalog, Search",3.34,,,,acry-econ-slntbck-signhld-3.5x-708101,Economy Slant Back Countertop Signholders,"Economy Slant Back Countertop Signholders, display",Economy Slant Back Countertop Signholders,/708101_base.jpg,Acry Econ Slntbck Signhld 3.5x base image,/708101_base.jpg,Acry Econ Slntbck Signhld 3.5x small image,/708101_base.jpg,Acry Econ Slntbck Signhld 3.5x thumbnail,,,,,,,,1,0,1,base,0,0
708102,,Default,simple,Default Category/Displays/Place Holder,Acry Econ Slntbck Signhld 5.5x,"<div align=left><span lang=en-us><font color=#000000 size=2 face=""Verdana, Helvetica"">These&nbsp;countertop sign holders are slanted back and made from 1/16"" acrylic and very economical to use. Sizes listed as&nbsp;Width by Height. Sold individually.</font></span></div>",Acrylic Sign Holders for Countertop Economy Slant Back,0.345,1,Taxable Goods,"Catalog, Search",3.34,,,,acry-econ-slntbck-signhld-5.5x-708102,Economy Slant Back Countertop Signholders,"Economy Slant Back Countertop Signholders, display",Economy Slant Back Countertop Signholders,/708102_base.jpg,Acry Econ Slntbck Signhld 5.5x base image,/708102_base.jpg,Acry Econ Slntbck Signhld 5.5x small image,/708102_base.jpg,Acry Econ Slntbck Signhld 5.5x thumbnail,,,,,,,,1,0,1,base,0,0
708109,,Default,simple,Default Category/Displays/Place Holder,Acry Econ Slntbck Signholdr,"<div align=left><span lang=en-us><font color=#000000 size=2 face=""Verdana, Helvetica"">These&nbsp;countertop sign holders are slanted back and made from 1/16"" acrylic and very economical to use. Sizes listed as&nbsp;Width by Height. Sold individually.</font></span></div>",Acrylic Sign Holders for Countertop Economy Slant Back,0.46,1,Taxable Goods,"Catalog, Search",5.13,,,,acry-econ-slntbck-signholdr-708109,Economy Slant Back Countertop Signholders,"Economy Slant Back Countertop Signholders, display",Economy Slant Back Countertop Signholders,/708109_base.jpg,Acry Econ Slntbck Signholdr base image,/708109_base.jpg,Acry Econ Slntbck Signholdr small image,/708109_base.jpg,Acry Econ Slntbck Signholdr thumbnail,,,,,,,,1,0,1,base,0,0
708110,,Default,simple,Default Category/Displays/Place Holder,Acry Econ Slntbck Signhldr 7x,"<div align=left><span lang=en-us><font color=#000000 size=2 face=""Verdana, Helvetica"">These&nbsp;countertop sign holders are slanted back and made from 1/16"" acrylic and very economical to use. Sizes listed as&nbsp;Width by Height. Sold individually.</font></span></div>",Acrylic Sign Holders for Countertop Economy Slant Back,0.46,1,Taxable Goods,"Catalog, Search",5.13,,,,acry-econ-slntbck-signhldr-7x-708110,Economy Slant Back Countertop Signholders,"Economy Slant Back Countertop Signholders, display",Economy Slant Back Countertop Signholders,/708110_base.jpg,Acry Econ Slntbck Signhldr 7x base image,/708110_base.jpg,Acry Econ Slntbck Signhldr 7x small image,/708110_base.jpg,Acry Econ Slntbck Signhldr 7x thumbnail,,,,,,,,1,0,1,base,0,0
70812,,Default,simple,Default Category/Displays/Place Holder,Plastic Broch Hldr 8-1/2x10,Plastic Broch Hldr 8-1/2x10,,0,1,Taxable Goods,"Catalog, Search",9.55,,,,plastic-broch-hldr-8-12x10-70812,,,,/70812_base.jpg,Plastic Broch Hldr 8-1/2x10 base image,/70812_base.jpg,Plastic Broch Hldr 8-1/2x10 small image,/70812_base.jpg,Plastic Broch Hldr 8-1/2x10 thumbnail,,,,,,,,1,0,1,base,0,0
708151,,Default,simple,Default Category/Displays/Place Holder,Acry Econ 2SD Signhldr 3.5x5.5,"<font size=2 face=Verdana>Economy Two Sided, Bottom loading sign holders get your customer's attention in both directions. You can use each side as the same message or use two different signs back to back. <br>Sold individually.</font>","Economy Acrylic Two Sided, Bottom Loading Sign Holders",0.92,1,Taxable Goods,"Catalog, Search",4.3,,,,acry-econ-2sd-signhldr-3.5x5.5-708151,,,,/708151_base.jpg,Acry Econ 2SD Signhldr 3.5x5.5 base image,/708151_base.jpg,Acry Econ 2SD Signhldr 3.5x5.5 small image,/708151_base.jpg,Acry Econ 2SD Signhldr 3.5x5.5 thumbnail,,,,,,,,1,0,1,base,0,0
708152,,Default,simple,Default Category/Displays/Place Holder,Acry Econ 2SD Signhldr 5.5x3.5,"<font size=2 face=Verdana>Economy Two Sided, Bottom loading sign holders get your customer's attention in both directions. You can use each side as the same message or use two different signs back to back. <br>Sold individually.</font>","Economy Acrylic Two Sided, Bottom Loading Sign Holders",0.345,1,Taxable Goods,"Catalog, Search",4.3,,,,acry-econ-2sd-signhldr-5.5x3.5-708152,,,,/708152_base.jpg,Acry Econ 2SD Signhldr 5.5x3.5 base image,/708152_base.jpg,Acry Econ 2SD Signhldr 5.5x3.5 small image,/708152_base.jpg,Acry Econ 2SD Signhldr 5.5x3.5 thumbnail,,,,,,,,1,0,1,base,0,0
708155,,Default,simple,Default Category/Displays/Place Holder,Acry Econ 2-SIDED Signhldr 5x7,"<font size=2 face=Verdana>Economy Two Sided, Bottom loading sign holders get your customer's attention in both directions. You can use each side as the same message or use two different signs back to back. <br>Sold individually.</font>","Economy Acrylic Two Sided, Bottom Loading Sign Holders",0.46,1,Taxable Goods,"Catalog, Search",5.85,,,,acry-econ-2-sided-signhldr-5x7-708155,,,,/708155_base.jpg,Acry Econ 2-SIDED Signhldr 5x7 base image,/708155_base.jpg,Acry Econ 2-SIDED Signhldr 5x7 small image,/708155_base.jpg,Acry Econ 2-SIDED Signhldr 5x7 thumbnail,,,,,,,,1,0,1,base,0,0
708156,,Default,simple,Default Category/Displays/Place Holder,Acry Econ 2-SIDE Signholdr 7x5,"<font size=2 face=Verdana>Economy Two Sided, Bottom loading sign holders get your customer's attention in both directions. You can use each side as the same message or use two different signs back to back. <br>Sold individually.</font>","Economy Acrylic Two Sided, Bottom Loading Sign Holders",0.46,1,Taxable Goods,"Catalog, Search",5.85,,,,acry-econ-2-side-signholdr-7x5-708156,,,,/708156_base.jpg,Acry Econ 2-SIDE Signholdr 7x5 base image,/708156_base.jpg,Acry Econ 2-SIDE Signholdr 7x5 small image,/708156_base.jpg,Acry Econ 2-SIDE Signholdr 7x5 thumbnail,,,,,,,,1,0,1,base,0,0
708159,,Default,simple,Default Category/Displays/Place Holder,Acry Econ 2SIDE Signhldr 5.5x7,"<font size=2 face=Verdana>Economy Two Sided, Bottom loading sign holders get your customer's attention in both directions. You can use each side as the same message or use two different signs back to back. <br>Sold individually.</font>","Economy Acrylic Two Sided, Bottom Loading Sign Holders",0.46,1,Taxable Goods,"Catalog, Search",6.2,,,,acry-econ-2side-signhldr-5.5x7-708159,,,,/708159_base.jpg,Acry Econ 2SIDE Signhldr 5.5x7 base image,/708159_base.jpg,Acry Econ 2SIDE Signhldr 5.5x7 small image,/708159_base.jpg,Acry Econ 2SIDE Signhldr 5.5x7 thumbnail,,,,,,,,1,0,1,base,0,0
708160,,Default,simple,Default Category/Displays/Place Holder,Acry Econ 2SIDE Signhldr 7x5.5,"<font size=2 face=Verdana>Economy Two Sided, Bottom loading sign holders get your customer's attention in both directions. You can use each side as the same message or use two different signs back to back. <br>Sold individually.</font>","Economy Acrylic Two Sided, Bottom Loading Sign Holders",0.46,1,Taxable Goods,"Catalog, Search",6.2,,,,acry-econ-2side-signhldr-7x5.5-708160,,,,/708160_base.jpg,Acry Econ 2SIDE Signhldr 7x5.5 base image,/708160_base.jpg,Acry Econ 2SIDE Signhldr 7x5.5 small image,/708160_base.jpg,Acry Econ 2SIDE Signhldr 7x5.5 thumbnail,,,,,,,,1,0,1,base,0,0
708163,,Default,simple,Default Category/Displays/Place Holder,Acry Econ 2SIDE Signhlder 7x11,"<font size=2 face=Verdana>Economy Two Sided, Bottom loading sign holders get your customer's attention in both directions. You can use each side as the same message or use two different signs back to back. <br>Sold individually.</font>","Economy Acrylic Two Sided, Bottom Loading Sign Holders",1.035,1,Taxable Goods,"Catalog, Search",9.55,,,,acry-econ-2side-signhlder-7x11-708163,,,,/708163_base.jpg,Acry Econ 2SIDE Signhlder 7x11 base image,/708163_base.jpg,Acry Econ 2SIDE Signhlder 7x11 small image,/708163_base.jpg,Acry Econ 2SIDE Signhlder 7x11 thumbnail,,,,,,,,1,0,1,base,0,0
70901X,,Default,simple,Default Category/Displays/Place Holder,"Acry Shelf Edge Retainer 5/8""x","<div>
<p><font size=2 face=Verdana>Use with glass or acrylic shelves to prevent merchandise from falling to the floor. It will work with 7/32"" to 1/4"" thick acrylic or glass shelves.</font></p></div>",Acrylic Shelf Edging,0.1495,1,Taxable Goods,"Catalog, Search",5.73,,,,"acry-shelf-edge-retainer-58""x-70901X",Acrylic Shelf Edging,Acrylic Shelf Edging,Acrylic Shelf Edging,/70901X_base.jpg,"Acry Shelf Edge Retainer 5/8""x base image",/70901X_base.jpg,"Acry Shelf Edge Retainer 5/8""x small image",/70901X_base.jpg,"Acry Shelf Edge Retainer 5/8""x thumbnail",,,,,,,,1,0,1,base,0,0
70903X,,Default,simple,Default Category/Displays/Place Holder,"Acry Shelf Edge Retainer 5/8""","<div>
<p><font size=2 face=Verdana>Use with glass or acrylic shelves to prevent merchandise from falling to the floor. It will work with 7/32"" to 1/4"" thick acrylic or glass shelves.</font></p></div>",Acrylic Shelf Edging,0.1725,1,Taxable Goods,"Catalog, Search",11.45,,,,"acry-shelf-edge-retainer-58""-70903X",Acrylic Shelf Edging,Acrylic Shelf Edging,Acrylic Shelf Edging,/70903X_base.jpg,"Acry Shelf Edge Retainer 5/8"" base image",/70903X_base.jpg,"Acry Shelf Edge Retainer 5/8"" small image",/70903X_base.jpg,"Acry Shelf Edge Retainer 5/8"" thumbnail",,,,,,,,1,0,1,base,0,0
70905X,,Default,simple,Default Category/No web item,Acry Shelf Edge Retainer 2x24,"<div>
<p><font size=2 face=Verdana>Use with glass or acrylic shelves to prevent merchandise from falling to the floor. It will work with 7/32"" to 1/4"" thick acrylic or glass shelves.</font></p></div>",Acrylic Shelf Edging,0.23,0,Taxable Goods,"Catalog, Search",8.11,,,,acry-shelf-edge-retainer-2x24-70905X,Acrylic Shelf Edging,Acrylic Shelf Edging,Acrylic Shelf Edging,/70905X_base.jpg,Acry Shelf Edge Retainer 2x24 base image,/70905X_base.jpg,Acry Shelf Edge Retainer 2x24 small image,/70905X_base.jpg,Acry Shelf Edge Retainer 2x24 thumbnail,,,,,,,,1,0,1,base,0,0
70906X,,Default,simple,Default Category/Displays/Place Holder,Acry Shelf Edge Retainer 2x30,"<div>
<p><font size=2 face=Verdana>Use with glass or acrylic shelves to prevent merchandise from falling to the floor. It will work with 7/32"" to 1/4"" thick acrylic or glass shelves.</font></p></div>",Acrylic Shelf Edging,0.2875,1,Taxable Goods,"Catalog, Search",10.02,,,,acry-shelf-edge-retainer-2x30-70906X,Acrylic Shelf Edging,Acrylic Shelf Edging,Acrylic Shelf Edging,/70906X_base.jpg,Acry Shelf Edge Retainer 2x30 base image,/70906X_base.jpg,Acry Shelf Edge Retainer 2x30 small image,/70906X_base.jpg,Acry Shelf Edge Retainer 2x30 thumbnail,,,,,,,,1,0,1,base,0,0
70907X,,Default,simple,Default Category/Displays/Place Holder,Acry Shelf Edge Retainer 2x48,"<div>
<p><font size=2 face=Verdana>Use with glass or acrylic shelves to prevent merchandise from falling to the floor. It will work with 7/32"" to 1/4"" thick acrylic or glass shelves.</font></p></div>",Acrylic Shelf Edging,0.345,1,Taxable Goods,"Catalog, Search",16.23,,,,acry-shelf-edge-retainer-2x48-70907X,Acrylic Shelf Edging,Acrylic Shelf Edging,Acrylic Shelf Edging,/70907X_base.jpg,Acry Shelf Edge Retainer 2x48 base image,/70907X_base.jpg,Acry Shelf Edge Retainer 2x48 small image,/70907X_base.jpg,Acry Shelf Edge Retainer 2x48 thumbnail,,,,,,,,1,0,1,base,0,0
